### ISSUE TITLE
Example Server cannot perform Read Request on Azure Kubernetes

### ISSUE THREAD

**Issue by tait-xnor** [eclipse/leshan#758]
Leshan Version: 1.0.0-M12 (plus three patches, given below)
Using DTLS: No

## Summary
I have created a Leshan server similar in to the [getting started guide](https://github.com/eclipse/leshan/wiki/Getting-Started-:-Server).  When running this server locally and connecting to it using the demo client (also running locally), I can register, perform a read request, and deregister just fine.  However, when I run this server on Azure Kubernetes, the registration works fine, but the client (still running locally) never receives the read request and the deregistration times out.

In the following materials, you will see from the tcpdump (done from my computer, which is hosting the client) that the client never received the read request.  However, the server logs seem to indicate that the server thought it had already sent the read request and it was waiting for the response.

So my question is basically: Why isn't the read request being delivered and how can I fix it?  I also realize that there are a lot of possible culprits in this stack: network latency, Kubernetes, and Azure.  I have included my Kubernetes yaml file, and I have confirmed that there is no firewall configured in Azure.

## Details
In this material I have replaced the IP address exposed by the Loadbalancer on my Kubernetes Cluster with `CL.UST.ER.IP`.
### Patches applied
```
From 39e76b3d04734393a1f59c358ba52d97ce27b2b1 Mon Sep 17 00:00:00 2001
From: Tait Madsen <tait.madsen@xnor.ai>
Date: Mon, 21 Oct 2019 11:24:37 -0700
Subject: [PATCH] Throw newly created exception in LwM2mModelRepository

---
 .../org/eclipse/leshan/core/model/LwM2mModelRepository.java     | 2 +-
 1 file changed, 1 insertion(+), 1 deletion(-)

diff --git a/leshan-core/src/main/java/org/eclipse/leshan/core/model/LwM2mModelRepository.java b/leshan-core/src/main/java/org/eclipse/leshan/core/model/LwM2mModelRepository.java
index e9b2142b..3c5b3911 100644
--- a/leshan-core/src/main/java/org/eclipse/leshan/core/model/LwM2mModelRepository.java
+++ b/leshan-core/src/main/java/org/eclipse/leshan/core/model/LwM2mModelRepository.java
@@ -49,7 +49,7 @@ public class LwM2mModelRepository {
             for (ObjectModel model : objectModels) {
                 String key = getKey(model);
                 if (key == null) {
-                    new IllegalArgumentException(String.format("Model %s is invalid : object id is missing.", model));
+                    throw new IllegalArgumentException(String.format("Model %s is invalid : object id is missing.", model));
                 }
                 ObjectModel old = map.put(key, model);
                 if (old != null) {
-- 
2.20.1 (Apple Git-117)

```

```
From 27df3acf64a3545f840c9c82a9dcf47d10733f03 Mon Sep 17 00:00:00 2001
From: Tait Madsen <tait.madsen@xnor.ai>
Date: Mon, 21 Oct 2019 14:10:09 -0700
Subject: [PATCH] In debug mode, dump stack when a Coap request is cancelled

---
 .../leshan/core/californium/CoapSyncRequestObserver.java       | 3 +++
 1 file changed, 3 insertions(+)

diff --git a/leshan-core-cf/src/main/java/org/eclipse/leshan/core/californium/CoapSyncRequestObserver.java b/leshan-core-cf/src/main/java/org/eclipse/leshan/core/californium/CoapSyncRequestObserver.java
index 3a5d1669..46c0be19 100644
--- a/leshan-core-cf/src/main/java/org/eclipse/leshan/core/californium/CoapSyncRequestObserver.java
+++ b/leshan-core-cf/src/main/java/org/eclipse/leshan/core/californium/CoapSyncRequestObserver.java
@@ -65,6 +65,9 @@ public class CoapSyncRequestObserver extends AbstractRequestObserver {
     @Override
     public void onCancel() {
         LOG.debug(String.format("Synchronous request cancelled %s", coapRequest));
+        if (LOG.isDebugEnabled()) {
+            Thread.dumpStack();
+        }
         latch.countDown();
     }
 
-- 
2.20.1 (Apple Git-117)

```

```
From 0042ef96c1831f0fdf78bc35621a42c131d9c388 Mon Sep 17 00:00:00 2001
From: Tait Madsen <tait.madsen@xnor.ai>
Date: Mon, 21 Oct 2019 13:02:34 -0700
Subject: [PATCH] Add logging for Registration#isAlive

---
 .../leshan/server/registration/Registration.java     | 12 +++++++++++-
 1 file changed, 11 insertions(+), 1 deletion(-)

diff --git a/leshan-server-core/src/main/java/org/eclipse/leshan/server/registration/Registration.java b/leshan-server-core/src/main/java/org/eclipse/leshan/server/registration/Registration.java
index afd17b79..ec93ebb0 100644
--- a/leshan-server-core/src/main/java/org/eclipse/leshan/server/registration/Registration.java
+++ b/leshan-server-core/src/main/java/org/eclipse/leshan/server/registration/Registration.java
@@ -36,12 +36,16 @@ import org.eclipse.leshan.core.request.BindingMode;
 import org.eclipse.leshan.core.request.Identity;
 import org.eclipse.leshan.util.StringUtils;
 import org.eclipse.leshan.util.Validate;
+import org.slf4j.Logger;
+import org.slf4j.LoggerFactory;
 
 /**
  * An immutable structure which represent a LW-M2M client registration on the server
  */
 public class Registration implements Serializable {
 
+    private static final Logger LOG = LoggerFactory.getLogger(Registration.class);
+
     private static final long serialVersionUID = 1L;
 
     private static final long DEFAULT_LIFETIME_IN_SEC = 86400L;
@@ -304,7 +308,13 @@ public class Registration implements Serializable {
      * @return true if the last registration update was done less than lifetime+gracePeriod seconds ago.
      */
     public boolean isAlive(long gracePeriodInSec) {
-        return getExpirationTimeStamp(gracePeriodInSec) > System.currentTimeMillis();
+        long expirationTimeStamp = getExpirationTimeStamp(gracePeriodInSec);
+        long currentTime = System.currentTimeMillis();
+        boolean isAlive = expirationTimeStamp > currentTime;
+        LOG.debug("Registration {} being checked for isAlive. Expiration: {} (including grace period of {} sec), " +
+                        "current time: {}, isAlive: {}",
+                this, expirationTimeStamp, gracePeriodInSec, currentTime, isAlive);
+        return isAlive;
     }
 
     public Map<String, String> getAdditionalRegistrationAttributes() {
-- 
2.20.1 (Apple Git-117)

```
### Server Code
```
package experimental.tait.lwm2m.src.main.java;

import org.eclipse.leshan.core.node.LwM2mResource;
import org.eclipse.leshan.core.observation.Observation;
import org.eclipse.leshan.core.request.ReadRequest;
import org.eclipse.leshan.core.response.ReadResponse;
import org.eclipse.leshan.server.californium.LeshanServerBuilder;
import org.eclipse.leshan.server.californium.impl.LeshanServer;
import org.eclipse.leshan.server.registration.Registration;
import org.eclipse.leshan.server.registration.RegistrationListener;
import org.eclipse.leshan.server.registration.RegistrationUpdate;
import org.slf4j.Logger;
import org.slf4j.LoggerFactory;

import java.util.Collection;

public class Server {

    private static final Logger LOG = LoggerFactory.getLogger(Server.class.getName());
    private static final ReadRequest LESHAN_DEMO_READ_REQUEST = new ReadRequest(3, 0, 13);

    public static void main(String[] args) {
        LeshanServerBuilder builder = new LeshanServerBuilder();
        LeshanServer server = builder.build();
        server.start();

        server.getRegistrationService().addListener(new RegistrationListener() {

            @Override
            public void registered(Registration registration,
                                   Registration previousRegistration,
                                   Collection<Observation> previousObservations) {
                LOG.info("new device: " + registration.getEndpoint());
                handleRegistration(registration);
            }

            @Override
            public void updated(RegistrationUpdate update,
                                Registration updatedRegistration,
                                Registration previousRegistration) {
                LOG.info("device is still here: " + updatedRegistration.getEndpoint());
                handleRegistration(updatedRegistration);
            }

            @Override
            public void unregistered(Registration registration,
                                     Collection<Observation> observations,
                                     boolean expired,
                                     Registration newRegistration) {
                LOG.info("device left: " + registration.getEndpoint());
            }

            private void handleRegistration(Registration registration) {
                try {
                    ReadResponse response = server.send(registration, LESHAN_DEMO_READ_REQUEST);
                    LOG.debug("Raw Response: " + response);
                    if (response.isSuccess()) {
                        LOG.info("Response content: " + ((LwM2mResource) response.getContent()).getValue());
                    } else {
                        LOG.info("Failed to read: " + response.getCode() + " " + response.getErrorMessage());
                    }
                } catch (InterruptedException e) {
                    e.printStackTrace();
                }
            }
        });
    }
}
```
### Kubernetes yaml
```
apiVersion: v1
kind: Service
metadata:
  name: lwm2m-service
spec:
  type: LoadBalancer
  selector:
    app: lwm2m-server
  ports:
    - protocol: UDP
      port: 5683
      targetPort: 5683
---
apiVersion: apps/v1
kind: Deployment
metadata:
  name: lwm2m-server-deployment
  labels:
    app: lwm2m-server
spec:
  replicas: 1
  selector:
    matchLabels:
      app: lwm2m-server
  template:
    metadata:
      labels:
        app: lwm2m-server
    spec:
      containers:
        - name: lwm2m-server
          # Tag will get replaced in deploy.sh
          image: sdsregistry.azurecr.io/lwm2m_server:<<TAG>>
          ports:
            - containerPort: 5683
              name: lwm2m
              protocol: UDP
          volumeMounts:
            - name: tz-config
              mountPath: /etc/localtime
      volumes:
        - name: tz-config
          hostPath:
            path: /usr/share/zoneinfo/America/Los_Angeles
```
### Server Log
This is DEBUG level, with the stack trace from CoapSyncRequestObserver#onCancel and the isAlive logs that I patched in.
```
2019-10-21 16:15:23:411 -0700 [main] DEBUG org.eclipse.leshan.core.model.ObjectLoader - Loading OMA standard object models
2019-10-21 16:15:23:416 -0700 [main] DEBUG org.eclipse.leshan.core.model.DDFFileParser - Parsing DDF file /models/LWM2M_Security-v1_0.xml
2019-10-21 16:15:23:452 -0700 [main] DEBUG org.eclipse.leshan.core.model.DDFFileParser - Parsing DDF file /models/LWM2M_Server-v1_0.xml
2019-10-21 16:15:23:457 -0700 [main] DEBUG org.eclipse.leshan.core.model.DDFFileParser - Parsing DDF file /models/LWM2M_Access_Control-v1_0.xml
2019-10-21 16:15:23:466 -0700 [main] DEBUG org.eclipse.leshan.core.model.DDFFileParser - Parsing DDF file /models/LWM2M_Device-v1_0.xml
2019-10-21 16:15:23:474 -0700 [main] DEBUG org.eclipse.leshan.core.model.DDFFileParser - Parsing DDF file /models/LWM2M_Connectivity_Monitoring-v1_0.xml
2019-10-21 16:15:23:481 -0700 [main] DEBUG org.eclipse.leshan.core.model.DDFFileParser - Parsing DDF file /models/LWM2M_Firmware_Update-v1_0.xml
2019-10-21 16:15:23:486 -0700 [main] DEBUG org.eclipse.leshan.core.model.DDFFileParser - Parsing DDF file /models/LWM2M_Location-v1_0.xml
2019-10-21 16:15:23:489 -0700 [main] DEBUG org.eclipse.leshan.core.model.DDFFileParser - Parsing DDF file /models/LWM2M_Connectivity_Statistics-v1_0.xml
2019-10-21 16:15:23:525 -0700 [main] INFO org.eclipse.californium.core.network.RandomTokenGenerator - using tokens of 8 bytes in length
2019-10-21 16:15:23:546 -0700 [main] INFO org.eclipse.californium.core.network.CoapEndpoint - CoapEndpoint uses udp plain
2019-10-21 16:15:23:568 -0700 [main] INFO org.eclipse.californium.core.network.stack.BlockwiseLayer - BlockwiseLayer uses MAX_MESSAGE_SIZE=1024, PREFERRED_BLOCK_SIZE=512, BLOCKWISE_STATUS_LIFETIME=300000, MAX_RESOURCE_BODY_SIZE=8192, BLOCKWISE_STRICT_BLOCK2_OPTION=false
2019-10-21 16:15:23:570 -0700 [main] INFO org.eclipse.californium.core.network.stack.ReliabilityLayer - ReliabilityLayer uses ACK_TIMEOUT=2000, ACK_RANDOM_FACTOR=1.5, and ACK_TIMEOUT_SCALE=2.0
2019-10-21 16:15:23:596 -0700 [main] INFO org.eclipse.californium.core.CoapServer - Starting server
2019-10-21 16:15:23:598 -0700 [main] DEBUG org.eclipse.californium.core.network.CoapEndpoint - Starting endpoint at coap://0.0.0.0:5683
2019-10-21 16:15:23:602 -0700 [main] DEBUG org.eclipse.californium.core.network.InMemoryMessageExchangeStore - no MessageIdProvider set, using default org.eclipse.californium.core.network.InMemoryMessageIdProvider
2019-10-21 16:15:23:609 -0700 [main] INFO org.eclipse.californium.elements.UDPConnector - UDPConnector starts up 1 sender threads and 1 receiver threads
2019-10-21 16:15:23:615 -0700 [UDP-Receiver-0.0.0.0/0.0.0.0:5683[0]] DEBUG org.eclipse.californium.elements.UDPConnector - Starting network stage thread [UDP-Receiver-0.0.0.0/0.0.0.0:5683[0]]
2019-10-21 16:15:23:615 -0700 [main] INFO org.eclipse.californium.elements.UDPConnector - UDPConnector listening on 0.0.0.0/0.0.0.0:5683, recv buf = 106496, send buf = 106496, recv packet size = 2048
2019-10-21 16:15:23:615 -0700 [main] INFO org.eclipse.californium.core.network.CoapEndpoint - Started endpoint at coap://0.0.0.0:5683
2019-10-21 16:15:23:615 -0700 [main] INFO org.eclipse.leshan.server.californium.impl.LeshanServer - LWM2M server started at coap://0.0.0.0/0.0.0.0:5683 
2019-10-21 16:15:23:616 -0700 [UDP-Sender-0.0.0.0/0.0.0.0:5683[0]] DEBUG org.eclipse.californium.elements.UDPConnector - Starting network stage thread [UDP-Sender-0.0.0.0/0.0.0.0:5683[0]]
2019-10-21 16:16:04:936 -0700 [UDP-Receiver-0.0.0.0/0.0.0.0:5683[0]] DEBUG org.eclipse.californium.elements.UDPConnector - UDPConnector (0.0.0.0/0.0.0.0:5683) received 120 bytes from /10.240.0.5:3658
2019-10-21 16:16:04:965 -0700 [CoapServer(main)#1] DEBUG org.eclipse.leshan.server.registration.RegistrationHandler - New registration: Registration [registrationDate=Mon Oct 21 16:16:04 PDT 2019, identity=Identity /10.240.0.5:3658[unsecure], registrationEndpoint=0.0.0.0/0.0.0.0:5683, lifeTimeInSec=30, smsNumber=null, lwM2mVersion=1.0, bindingMode=U, endpoint=TMadsen-MBP.corp.xnor.ai, registrationId=ukZ1UDLbbC, objectLinks=[</>;rt="oma.lwm2m", </1/0>, </3/0>, </6/0>, </3303/0>], lastUpdate=Mon Oct 21 16:16:04 PDT 2019]
2019-10-21 16:16:04:979 -0700 [CoapServer(main)#1] DEBUG org.eclipse.californium.core.network.stack.ReliabilityLayer - Exchange[R1] send response null-2.01   MID=   -1, Token=null, OptionSet={"Location-Path":["rd","ukZ1UDLbbC"]}, no payload, failed transmissions: 0
2019-10-21 16:16:04:979 -0700 [CoapServer(main)#1] DEBUG org.eclipse.californium.core.network.Exchange - Exchange[R1, complete]!
2019-10-21 16:16:04:981 -0700 [CoapServer(main)#1] DEBUG org.eclipse.californium.core.network.Exchange - Remote Exchange[R1, complete] completed ACK-2.01   MID=23192, Token=10938E57D46FCE21, OptionSet={"Location-Path":["rd","ukZ1UDLbbC"]}, no payload!
2019-10-21 16:16:04:983 -0700 [CoapServer(main)#1] INFO experimental.tait.lwm2m.src.main.java.Server - new device: TMadsen-MBP.corp.xnor.ai
2019-10-21 16:16:04:984 -0700 [UDP-Sender-0.0.0.0/0.0.0.0:5683[0]] DEBUG org.eclipse.californium.elements.UDPConnector - UDPConnector (Thread[UDP-Sender-0.0.0.0/0.0.0.0:5683[0],5,Californium/Elements]) sent 26 bytes to /10.240.0.5:3658
2019-10-21 16:16:05:596 -0700 [InMemoryRegistrationStore Cleaner (2s)] DEBUG org.eclipse.leshan.server.registration.Registration - Registration Registration [registrationDate=Mon Oct 21 16:16:04 PDT 2019, identity=Identity /10.240.0.5:3658[unsecure], registrationEndpoint=0.0.0.0/0.0.0.0:5683, lifeTimeInSec=30, smsNumber=null, lwM2mVersion=1.0, bindingMode=U, endpoint=TMadsen-MBP.corp.xnor.ai, registrationId=ukZ1UDLbbC, objectLinks=[</>;rt="oma.lwm2m", </1/0>, </3/0>, </6/0>, </3303/0>], lastUpdate=Mon Oct 21 16:16:04 PDT 2019] being checked for isAlive. Expiration: 1571699794958 (including grace period of 0 sec), current time: 1571699765595, isAlive: true
2019-10-21 16:16:07:596 -0700 [InMemoryRegistrationStore Cleaner (2s)] DEBUG org.eclipse.leshan.server.registration.Registration - Registration Registration [registrationDate=Mon Oct 21 16:16:04 PDT 2019, identity=Identity /10.240.0.5:3658[unsecure], registrationEndpoint=0.0.0.0/0.0.0.0:5683, lifeTimeInSec=30, smsNumber=null, lwM2mVersion=1.0, bindingMode=U, endpoint=TMadsen-MBP.corp.xnor.ai, registrationId=ukZ1UDLbbC, objectLinks=[</>;rt="oma.lwm2m", </1/0>, </3/0>, </6/0>, </3303/0>], lastUpdate=Mon Oct 21 16:16:04 PDT 2019] being checked for isAlive. Expiration: 1571699794958 (including grace period of 0 sec), current time: 1571699767595, isAlive: true
2019-10-21 16:16:09:596 -0700 [InMemoryRegistrationStore Cleaner (2s)] DEBUG org.eclipse.leshan.server.registration.Registration - Registration Registration [registrationDate=Mon Oct 21 16:16:04 PDT 2019, identity=Identity /10.240.0.5:3658[unsecure], registrationEndpoint=0.0.0.0/0.0.0.0:5683, lifeTimeInSec=30, smsNumber=null, lwM2mVersion=1.0, bindingMode=U, endpoint=TMadsen-MBP.corp.xnor.ai, registrationId=ukZ1UDLbbC, objectLinks=[</>;rt="oma.lwm2m", </1/0>, </3/0>, </6/0>, </3303/0>], lastUpdate=Mon Oct 21 16:16:04 PDT 2019] being checked for isAlive. Expiration: 1571699794958 (including grace period of 0 sec), current time: 1571699769595, isAlive: true
2019-10-21 16:16:11:596 -0700 [InMemoryRegistrationStore Cleaner (2s)] DEBUG org.eclipse.leshan.server.registration.Registration - Registration Registration [registrationDate=Mon Oct 21 16:16:04 PDT 2019, identity=Identity /10.240.0.5:3658[unsecure], registrationEndpoint=0.0.0.0/0.0.0.0:5683, lifeTimeInSec=30, smsNumber=null, lwM2mVersion=1.0, bindingMode=U, endpoint=TMadsen-MBP.corp.xnor.ai, registrationId=ukZ1UDLbbC, objectLinks=[</>;rt="oma.lwm2m", </1/0>, </3/0>, </6/0>, </3303/0>], lastUpdate=Mon Oct 21 16:16:04 PDT 2019] being checked for isAlive. Expiration: 1571699794958 (including grace period of 0 sec), current time: 1571699771595, isAlive: true
2019-10-21 16:16:13:596 -0700 [InMemoryRegistrationStore Cleaner (2s)] DEBUG org.eclipse.leshan.server.registration.Registration - Registration Registration [registrationDate=Mon Oct 21 16:16:04 PDT 2019, identity=Identity /10.240.0.5:3658[unsecure], registrationEndpoint=0.0.0.0/0.0.0.0:5683, lifeTimeInSec=30, smsNumber=null, lwM2mVersion=1.0, bindingMode=U, endpoint=TMadsen-MBP.corp.xnor.ai, registrationId=ukZ1UDLbbC, objectLinks=[</>;rt="oma.lwm2m", </1/0>, </3/0>, </6/0>, </3303/0>], lastUpdate=Mon Oct 21 16:16:04 PDT 2019] being checked for isAlive. Expiration: 1571699794958 (including grace period of 0 sec), current time: 1571699773595, isAlive: true
2019-10-21 16:16:13:602 -0700 [CoapServer(secondary)#1] DEBUG org.eclipse.californium.core.network.deduplication.SweepDeduplicator - Sweep run took 0ms
2019-10-21 16:16:15:595 -0700 [InMemoryRegistrationStore Cleaner (2s)] DEBUG org.eclipse.leshan.server.registration.Registration - Registration Registration [registrationDate=Mon Oct 21 16:16:04 PDT 2019, identity=Identity /10.240.0.5:3658[unsecure], registrationEndpoint=0.0.0.0/0.0.0.0:5683, lifeTimeInSec=30, smsNumber=null, lwM2mVersion=1.0, bindingMode=U, endpoint=TMadsen-MBP.corp.xnor.ai, registrationId=ukZ1UDLbbC, objectLinks=[</>;rt="oma.lwm2m", </1/0>, </3/0>, </6/0>, </3303/0>], lastUpdate=Mon Oct 21 16:16:04 PDT 2019] being checked for isAlive. Expiration: 1571699794958 (including grace period of 0 sec), current time: 1571699775595, isAlive: true
2019-10-21 16:16:17:595 -0700 [InMemoryRegistrationStore Cleaner (2s)] DEBUG org.eclipse.leshan.server.registration.Registration - Registration Registration [registrationDate=Mon Oct 21 16:16:04 PDT 2019, identity=Identity /10.240.0.5:3658[unsecure], registrationEndpoint=0.0.0.0/0.0.0.0:5683, lifeTimeInSec=30, smsNumber=null, lwM2mVersion=1.0, bindingMode=U, endpoint=TMadsen-MBP.corp.xnor.ai, registrationId=ukZ1UDLbbC, objectLinks=[</>;rt="oma.lwm2m", </1/0>, </3/0>, </6/0>, </3303/0>], lastUpdate=Mon Oct 21 16:16:04 PDT 2019] being checked for isAlive. Expiration: 1571699794958 (including grace period of 0 sec), current time: 1571699777595, isAlive: true
2019-10-21 16:16:18:202 -0700 [UDP-Receiver-0.0.0.0/0.0.0.0:5683[0]] DEBUG org.eclipse.californium.elements.UDPConnector - UDPConnector (0.0.0.0/0.0.0.0:5683) received 26 bytes from /10.240.0.5:3658
2019-10-21 16:16:19:595 -0700 [InMemoryRegistrationStore Cleaner (2s)] DEBUG org.eclipse.leshan.server.registration.Registration - Registration Registration [registrationDate=Mon Oct 21 16:16:04 PDT 2019, identity=Identity /10.240.0.5:3658[unsecure], registrationEndpoint=0.0.0.0/0.0.0.0:5683, lifeTimeInSec=30, smsNumber=null, lwM2mVersion=1.0, bindingMode=U, endpoint=TMadsen-MBP.corp.xnor.ai, registrationId=ukZ1UDLbbC, objectLinks=[</>;rt="oma.lwm2m", </1/0>, </3/0>, </6/0>, </3303/0>], lastUpdate=Mon Oct 21 16:16:04 PDT 2019] being checked for isAlive. Expiration: 1571699794958 (including grace period of 0 sec), current time: 1571699779595, isAlive: true
2019-10-21 16:16:21:595 -0700 [InMemoryRegistrationStore Cleaner (2s)] DEBUG org.eclipse.leshan.server.registration.Registration - Registration Registration [registrationDate=Mon Oct 21 16:16:04 PDT 2019, identity=Identity /10.240.0.5:3658[unsecure], registrationEndpoint=0.0.0.0/0.0.0.0:5683, lifeTimeInSec=30, smsNumber=null, lwM2mVersion=1.0, bindingMode=U, endpoint=TMadsen-MBP.corp.xnor.ai, registrationId=ukZ1UDLbbC, objectLinks=[</>;rt="oma.lwm2m", </1/0>, </3/0>, </6/0>, </3303/0>], lastUpdate=Mon Oct 21 16:16:04 PDT 2019] being checked for isAlive. Expiration: 1571699794958 (including grace period of 0 sec), current time: 1571699781595, isAlive: true
2019-10-21 16:16:23:596 -0700 [InMemoryRegistrationStore Cleaner (2s)] DEBUG org.eclipse.leshan.server.registration.Registration - Registration Registration [registrationDate=Mon Oct 21 16:16:04 PDT 2019, identity=Identity /10.240.0.5:3658[unsecure], registrationEndpoint=0.0.0.0/0.0.0.0:5683, lifeTimeInSec=30, smsNumber=null, lwM2mVersion=1.0, bindingMode=U, endpoint=TMadsen-MBP.corp.xnor.ai, registrationId=ukZ1UDLbbC, objectLinks=[</>;rt="oma.lwm2m", </1/0>, </3/0>, </6/0>, </3303/0>], lastUpdate=Mon Oct 21 16:16:04 PDT 2019] being checked for isAlive. Expiration: 1571699794958 (including grace period of 0 sec), current time: 1571699783595, isAlive: true
2019-10-21 16:16:23:602 -0700 [CoapServer(secondary)#1] DEBUG org.eclipse.californium.core.network.deduplication.SweepDeduplicator - Sweep run took 0ms
2019-10-21 16:16:25:595 -0700 [InMemoryRegistrationStore Cleaner (2s)] DEBUG org.eclipse.leshan.server.registration.Registration - Registration Registration [registrationDate=Mon Oct 21 16:16:04 PDT 2019, identity=Identity /10.240.0.5:3658[unsecure], registrationEndpoint=0.0.0.0/0.0.0.0:5683, lifeTimeInSec=30, smsNumber=null, lwM2mVersion=1.0, bindingMode=U, endpoint=TMadsen-MBP.corp.xnor.ai, registrationId=ukZ1UDLbbC, objectLinks=[</>;rt="oma.lwm2m", </1/0>, </3/0>, </6/0>, </3303/0>], lastUpdate=Mon Oct 21 16:16:04 PDT 2019] being checked for isAlive. Expiration: 1571699794958 (including grace period of 0 sec), current time: 1571699785595, isAlive: true
2019-10-21 16:16:27:596 -0700 [InMemoryRegistrationStore Cleaner (2s)] DEBUG org.eclipse.leshan.server.registration.Registration - Registration Registration [registrationDate=Mon Oct 21 16:16:04 PDT 2019, identity=Identity /10.240.0.5:3658[unsecure], registrationEndpoint=0.0.0.0/0.0.0.0:5683, lifeTimeInSec=30, smsNumber=null, lwM2mVersion=1.0, bindingMode=U, endpoint=TMadsen-MBP.corp.xnor.ai, registrationId=ukZ1UDLbbC, objectLinks=[</>;rt="oma.lwm2m", </1/0>, </3/0>, </6/0>, </3303/0>], lastUpdate=Mon Oct 21 16:16:04 PDT 2019] being checked for isAlive. Expiration: 1571699794958 (including grace period of 0 sec), current time: 1571699787595, isAlive: true
2019-10-21 16:16:29:595 -0700 [InMemoryRegistrationStore Cleaner (2s)] DEBUG org.eclipse.leshan.server.registration.Registration - Registration Registration [registrationDate=Mon Oct 21 16:16:04 PDT 2019, identity=Identity /10.240.0.5:3658[unsecure], registrationEndpoint=0.0.0.0/0.0.0.0:5683, lifeTimeInSec=30, smsNumber=null, lwM2mVersion=1.0, bindingMode=U, endpoint=TMadsen-MBP.corp.xnor.ai, registrationId=ukZ1UDLbbC, objectLinks=[</>;rt="oma.lwm2m", </1/0>, </3/0>, </6/0>, </3303/0>], lastUpdate=Mon Oct 21 16:16:04 PDT 2019] being checked for isAlive. Expiration: 1571699794958 (including grace period of 0 sec), current time: 1571699789595, isAlive: true
2019-10-21 16:16:31:596 -0700 [InMemoryRegistrationStore Cleaner (2s)] DEBUG org.eclipse.leshan.server.registration.Registration - Registration Registration [registrationDate=Mon Oct 21 16:16:04 PDT 2019, identity=Identity /10.240.0.5:3658[unsecure], registrationEndpoint=0.0.0.0/0.0.0.0:5683, lifeTimeInSec=30, smsNumber=null, lwM2mVersion=1.0, bindingMode=U, endpoint=TMadsen-MBP.corp.xnor.ai, registrationId=ukZ1UDLbbC, objectLinks=[</>;rt="oma.lwm2m", </1/0>, </3/0>, </6/0>, </3303/0>], lastUpdate=Mon Oct 21 16:16:04 PDT 2019] being checked for isAlive. Expiration: 1571699794958 (including grace period of 0 sec), current time: 1571699791595, isAlive: true
2019-10-21 16:16:33:596 -0700 [InMemoryRegistrationStore Cleaner (2s)] DEBUG org.eclipse.leshan.server.registration.Registration - Registration Registration [registrationDate=Mon Oct 21 16:16:04 PDT 2019, identity=Identity /10.240.0.5:3658[unsecure], registrationEndpoint=0.0.0.0/0.0.0.0:5683, lifeTimeInSec=30, smsNumber=null, lwM2mVersion=1.0, bindingMode=U, endpoint=TMadsen-MBP.corp.xnor.ai, registrationId=ukZ1UDLbbC, objectLinks=[</>;rt="oma.lwm2m", </1/0>, </3/0>, </6/0>, </3303/0>], lastUpdate=Mon Oct 21 16:16:04 PDT 2019] being checked for isAlive. Expiration: 1571699794958 (including grace period of 0 sec), current time: 1571699793595, isAlive: true
2019-10-21 16:16:33:602 -0700 [CoapServer(secondary)#1] DEBUG org.eclipse.californium.core.network.deduplication.SweepDeduplicator - Sweep run took 0ms
2019-10-21 16:16:35:595 -0700 [InMemoryRegistrationStore Cleaner (2s)] DEBUG org.eclipse.leshan.server.registration.Registration - Registration Registration [registrationDate=Mon Oct 21 16:16:04 PDT 2019, identity=Identity /10.240.0.5:3658[unsecure], registrationEndpoint=0.0.0.0/0.0.0.0:5683, lifeTimeInSec=30, smsNumber=null, lwM2mVersion=1.0, bindingMode=U, endpoint=TMadsen-MBP.corp.xnor.ai, registrationId=ukZ1UDLbbC, objectLinks=[</>;rt="oma.lwm2m", </1/0>, </3/0>, </6/0>, </3303/0>], lastUpdate=Mon Oct 21 16:16:04 PDT 2019] being checked for isAlive. Expiration: 1571699794958 (including grace period of 0 sec), current time: 1571699795595, isAlive: false
2019-10-21 16:16:35:597 -0700 [InMemoryRegistrationStore Cleaner (2s)] DEBUG org.eclipse.leshan.core.californium.CoapSyncRequestObserver - Synchronous request cancelled CON-GET    MID=   -1, Token=null, OptionSet={"Uri-Path":["3","0","13"]}, no payload
java.lang.Exception: Stack trace
	at java.lang.Thread.dumpStack(Thread.java:1336)
	at org.eclipse.leshan.core.californium.CoapSyncRequestObserver.onCancel(CoapSyncRequestObserver.java:69)
	at org.eclipse.californium.core.coap.Message.setCanceled(Message.java:772)
	at org.eclipse.californium.core.coap.Request.setCanceled(Request.java:790)
	at org.eclipse.californium.core.coap.Message.cancel(Message.java:965)
	at org.eclipse.leshan.server.californium.impl.CaliforniumLwM2mRequestSender.cancelPendingRequests(CaliforniumLwM2mRequestSender.java:199)
	at org.eclipse.leshan.server.queue.QueueModeLwM2mRequestSender.cancelPendingRequests(QueueModeLwM2mRequestSender.java:121)
	at org.eclipse.leshan.server.californium.impl.LeshanServer$1.unregistered(LeshanServer.java:164)
	at org.eclipse.leshan.server.impl.RegistrationServiceImpl.registrationExpired(RegistrationServiceImpl.java:73)
	at org.eclipse.leshan.server.californium.impl.InMemoryRegistrationStore$Cleaner.run(InMemoryRegistrationStore.java:488)
	at java.util.concurrent.Executors$RunnableAdapter.call(Executors.java:511)
	at java.util.concurrent.FutureTask.runAndReset(FutureTask.java:308)
	at java.util.concurrent.ScheduledThreadPoolExecutor$ScheduledFutureTask.access$301(ScheduledThreadPoolExecutor.java:180)
	at java.util.concurrent.ScheduledThreadPoolExecutor$ScheduledFutureTask.run(ScheduledThreadPoolExecutor.java:294)
	at java.util.concurrent.ThreadPoolExecutor.runWorker(ThreadPoolExecutor.java:1149)
	at java.util.concurrent.ThreadPoolExecutor$Worker.run(ThreadPoolExecutor.java:624)
	at java.lang.Thread.run(Thread.java:748)
2019-10-21 16:16:35:599 -0700 [InMemoryRegistrationStore Cleaner (2s)] INFO experimental.tait.lwm2m.src.main.java.Server - device left: TMadsen-MBP.corp.xnor.ai
2019-10-21 16:16:35:599 -0700 [CoapServer(main)#1] DEBUG experimental.tait.lwm2m.src.main.java.Server - Raw Response: null
2019-10-21 16:16:35:600 -0700 [CoapServer(main)#1] ERROR org.eclipse.leshan.core.response.SendableResponse - Exception while calling the reponse sent callback
java.lang.NullPointerException
	at experimental.tait.lwm2m.src.main.java.Server$1.handleRegistration(Server.java:57)
	at experimental.tait.lwm2m.src.main.java.Server$1.registered(Server.java:34)
	at org.eclipse.leshan.server.impl.RegistrationServiceImpl.fireRegistered(RegistrationServiceImpl.java:80)
	at org.eclipse.leshan.server.registration.RegistrationHandler$1.run(RegistrationHandler.java:87)
	at org.eclipse.leshan.core.response.SendableResponse.sent(SendableResponse.java:47)
	at org.eclipse.leshan.server.californium.impl.RegisterResource.handleRegister(RegisterResource.java:178)
	at org.eclipse.leshan.server.californium.impl.RegisterResource.handlePOST(RegisterResource.java:96)
	at org.eclipse.californium.core.CoapResource.handleRequest(CoapResource.java:223)
	at org.eclipse.leshan.core.californium.LwM2mCoapResource.handleRequest(LwM2mCoapResource.java:50)
	at org.eclipse.californium.core.server.ServerMessageDeliverer.deliverRequest(ServerMessageDeliverer.java:108)
	at org.eclipse.californium.core.network.stack.BaseCoapStack$StackTopAdapter.receiveRequest(BaseCoapStack.java:200)
	at org.eclipse.californium.core.network.stack.AbstractLayer.receiveRequest(AbstractLayer.java:84)
	at org.eclipse.californium.core.network.stack.AbstractLayer.receiveRequest(AbstractLayer.java:84)
	at org.eclipse.californium.core.network.stack.BlockwiseLayer.receiveRequest(BlockwiseLayer.java:395)
	at org.eclipse.californium.core.network.stack.ReliabilityLayer.receiveRequest(ReliabilityLayer.java:262)
	at org.eclipse.californium.core.network.stack.AbstractLayer.receiveRequest(AbstractLayer.java:84)
	at org.eclipse.californium.core.network.stack.BaseCoapStack.receiveRequest(BaseCoapStack.java:133)
	at org.eclipse.californium.core.network.CoapEndpoint$1.receiveRequest(CoapEndpoint.java:250)
	at org.eclipse.californium.core.network.UdpMatcher$2.run(UdpMatcher.java:251)
	at org.eclipse.californium.elements.util.SerialExecutor$1.run(SerialExecutor.java:277)
	at java.util.concurrent.Executors$RunnableAdapter.call(Executors.java:511)
	at java.util.concurrent.FutureTask.run(FutureTask.java:266)
	at java.util.concurrent.ScheduledThreadPoolExecutor$ScheduledFutureTask.access$201(ScheduledThreadPoolExecutor.java:180)
	at java.util.concurrent.ScheduledThreadPoolExecutor$ScheduledFutureTask.run(ScheduledThreadPoolExecutor.java:293)
	at java.util.concurrent.ThreadPoolExecutor.runWorker(ThreadPoolExecutor.java:1149)
	at java.util.concurrent.ThreadPoolExecutor$Worker.run(ThreadPoolExecutor.java:624)
	at java.lang.Thread.run(Thread.java:748)
2019-10-21 16:16:35:602 -0700 [CoapServer(main)#1] DEBUG org.eclipse.californium.core.network.stack.ReliabilityLayer - Exchange[L2] send request, failed transmissions: 0
2019-10-21 16:16:35:602 -0700 [CoapServer(main)#1] DEBUG org.eclipse.californium.core.network.stack.ReliabilityLayer - Exchange[L2] prepare retransmission for CON-GET    MID=   -1, Token=null, OptionSet={"Uri-Path":["3","0","13"]}, no payload
2019-10-21 16:16:35:604 -0700 [CoapServer(main)#1] DEBUG org.eclipse.californium.core.network.InMemoryMessageExchangeStore - Exchange[L2] added with generated mid KeyMID[45980, [0af00005]:3658], CON-GET    MID=45980, Token=null, OptionSet={"Uri-Path":["3","0","13"]}, no payload
2019-10-21 16:16:35:605 -0700 [CoapServer(main)#1] DEBUG org.eclipse.californium.core.network.InMemoryMessageExchangeStore - Exchange[L2] added with generated token Token=7A7C30765D366D53, CON-GET    MID=45980, Token=7A7C30765D366D53, OptionSet={"Uri-Path":["3","0","13"]}, no payload
2019-10-21 16:16:35:605 -0700 [CoapServer(main)#1] DEBUG org.eclipse.californium.core.network.UdpMatcher - tracking open request [MID: 45980, Token: Token=7A7C30765D366D53]
2019-10-21 16:16:35:605 -0700 [CoapServer(main)#1] DEBUG org.eclipse.californium.core.network.Exchange - Exchange[L2, complete]!
2019-10-21 16:16:35:605 -0700 [CoapServer(main)#1] DEBUG org.eclipse.californium.core.network.InMemoryMessageExchangeStore - removing Exchange[L2, complete] for token Token=7A7C30765D366D53
2019-10-21 16:16:35:606 -0700 [CoapServer(main)#1] DEBUG org.eclipse.californium.core.network.InMemoryMessageExchangeStore - removing Exchange[L2, complete] for MID KeyMID[45980, [0af00005]:3658]
2019-10-21 16:16:35:606 -0700 [CoapServer(main)#1] DEBUG org.eclipse.californium.core.network.Exchange - local Exchange[L2, complete] completed CON-GET    MID=45980, Token=7A7C30765D366D53, OptionSet={"Uri-Path":["3","0","13"]}, no payload!
2019-10-21 16:16:35:608 -0700 [CoapServer(main)#1] DEBUG org.eclipse.californium.core.network.stack.ReliabilityLayer - Exchange[R3] send response null-4.04   MID=   -1, Token=null, OptionSet={"Content-Format":"text/plain"}, no payload, failed transmissions: 0
2019-10-21 16:16:35:608 -0700 [CoapServer(main)#1] DEBUG org.eclipse.californium.core.network.Exchange - Exchange[R3, complete]!
2019-10-21 16:16:35:608 -0700 [CoapServer(main)#1] DEBUG org.eclipse.californium.core.network.Exchange - Remote Exchange[R3, complete] completed ACK-4.04   MID=23193, Token=0C8A15FD20A180FD, OptionSet={"Content-Format":"text/plain"}, no payload!
2019-10-21 16:16:35:609 -0700 [UDP-Sender-0.0.0.0/0.0.0.0:5683[0]] DEBUG org.eclipse.californium.elements.UDPConnector - UDPConnector (Thread[UDP-Sender-0.0.0.0/0.0.0.0:5683[0],5,Californium/Elements]) sent 13 bytes to /10.240.0.5:3658
2019-10-21 16:16:43:602 -0700 [CoapServer(secondary)#1] DEBUG org.eclipse.californium.core.network.deduplication.SweepDeduplicator - Sweep run took 0ms
2019-10-21 16:16:53:602 -0700 [CoapServer(secondary)#1] DEBUG org.eclipse.californium.core.network.deduplication.SweepDeduplicator - Sweep run took 0ms
2019-10-21 16:17:03:602 -0700 [CoapServer(secondary)#1] DEBUG org.eclipse.californium.core.network.deduplication.SweepDeduplicator - Sweep run took 0ms
2019-10-21 16:17:13:602 -0700 [CoapServer(secondary)#1] DEBUG org.eclipse.californium.core.network.deduplication.SweepDeduplicator - Sweep run took 0ms
2019-10-21 16:17:23:602 -0700 [CoapServer(secondary)#1] DEBUG org.eclipse.californium.core.network.deduplication.SweepDeduplicator - Sweep run took 0ms
2019-10-21 16:17:33:602 -0700 [CoapServer(secondary)#1] DEBUG org.eclipse.californium.core.network.deduplication.SweepDeduplicator - Sweep run took 0ms
2019-10-21 16:17:43:602 -0700 [CoapServer(secondary)#1] DEBUG org.eclipse.californium.core.network.deduplication.SweepDeduplicator - Sweep run took 0ms
```
### Client Log
From running `java -jar leshan-client-demo.jar -u CL.UST.ER.IP:5683`
```
2019-10-21 16:16:04,877 INFO LeshanClientDemo - Press 'w','a','s','d' to change reported Location (-36.0,27.0).
2019-10-21 16:16:04,877 INFO LeshanClient - Starting Leshan client ...
2019-10-21 16:16:04,917 INFO CaliforniumEndpointsManager - New endpoint created for server coap://CL.UST.ER.IP:5683 at coap://0.0.0.0:63697
2019-10-21 16:16:04,917 INFO LeshanClient - Leshan client[endpoint:TMadsen-MBP.corp.xnor.ai] started.
2019-10-21 16:16:04,918 INFO RegistrationEngine - Trying to register to coap://CL.UST.ER.IP:5683 ...
2019-10-21 16:16:04,992 INFO RegistrationEngine - Registered with location '/rd/ukZ1UDLbbC'.
2019-10-21 16:16:04,992 INFO RegistrationEngine - Next registration update to coap://CL.UST.ER.IP:5683 in 27s...
^C2019-10-21 16:16:18,193 INFO LeshanClient - Destroying Leshan client ...
2019-10-21 16:16:18,194 INFO RegistrationEngine - Trying to deregister to coap://CL.UST.ER.IP:5683 ...
2019-10-21 16:16:19,202 ERROR RegistrationEngine - Deregistration failed: Timeout.
2019-10-21 16:16:19,206 INFO LeshanClient - Leshan client destroyed.
```
### TCP Dump
From running `tcpdump -A -i 8 host CL.UST.ER.IP`
```
tcpdump: verbose output suppressed, use -v or -vv for full protocol decode
listening on en7, link-type EN10MB (Ethernet), capture size 262144 bytes
16:16:04.930662 IP tmadsen-mbp.corp.xnor.ai.63697 > CL.UST.ER.IP.5683: UDP, length 120
E.......@.0.

.^4.X....3..{.H.Z....W.o.!.rd.(3b=U	lwm2m=1.0.lt=30..ep=TMadsen-MBP.corp.xnor.ai.</>;rt="oma.lwm2m", </1/0>, </3/0>, </6/0>, </3303/0>
16:16:04.985586 IP CL.UST.ER.IP.5683 > tmadsen-mbp.corp.xnor.ai.63697: UDP, length 26
E..6..@.1...4.X.

.^.3...".uhAZ....W.o.!.rd
ukZ1UDLbbC
16:16:18.196100 IP tmadsen-mbp.corp.xnor.ai.63697 > CL.UST.ER.IP.5683: UDP, length 26
E..6V#..@...

.^4.X....3."..H.Z..... ....rd
ukZ1UDLbbC
^C
3 packets captured
789 packets received by filter
0 packets dropped by kernel
```

**Comment by sbernard31** [comment]
It seems you find an issue (missing throw) in `LwM2mModelRepository`, I will fix this ! 

About your issue, is it possible you run Leshan server on a 1 core CPU ?
If yes, the "default CoAP config" + "using sync send" could be the issue. (see https://github.com/eclipse/leshan/issues/756#issuecomment-541068857 for more details)

**Comment by tait-xnor** [comment]
Wow, thank you!  I increased `PROTOCOL_STAGE_THREAD_COUNT` to 5 and that fixed the issue! The client now receives the read request, and the server receives the response.  I am not sure if I am running on 1 core CPU - the number of CPUs being used are abstracted from me on Kubernetes.  For posterity, the server initialization portion of my server code is now:
```java
LeshanServerBuilder builder = new LeshanServerBuilder();
NetworkConfig networkConfig = LeshanServerBuilder.createDefaultNetworkConfig();
networkConfig.set(NetworkConfig.Keys.PROTOCOL_STAGE_THREAD_COUNT, 5);
builder.setCoapConfig(networkConfig);
LeshanServer server = builder.build();
server.start();
```

**Comment by sbernard31** [comment]
If you want to know that the number of core, log or sysout this : 
`Runtime.getRuntime().availableProcessors();`

Increase number of thread is OK but keep in mind that you should probably use async call instead of sync call.

**Comment by tait-xnor** [comment]
Cool, thanks!
