### ISSUE TITLE
UDP responses should use same IP as the receiving (registration) one

### ISSUE THREAD

**Issue by alexbarcelo** [eclipse/leshan#1051]
Disclaimer: Maybe I am messing my network or have done something wrong. I believe that that's not the case, I hope it's not my fault.

After some problems and doing a `tcpdump` I detected the following:

```
14:40:38.718069 IP6 [client_IP].62306 > [server_static_IP].5683: UDP, length 100
14:40:38.718997 IP6 [server_dynamic_IP].5683 > [client_IP].62306: UDP, length 26
14:40:38.737724 IP6 [client_IP] > [server_dynamic_IP]: ICMP6, destination unreachable, unreachable port, [client_IP] udp port 62306, length 56
```

The server has two IPv6, a static one (SLAAC hwaddr, although I believe that the exact mechanism is not relevant) and the private one (this is something standard in POSIX network stack, right?). The client knows the static IP of the server. However, after the client registers to the LwM2M server (the client appears in the web interface), the client complains about not receiving response and then proceeds to timeout the connection. Nothing works regarding the client connection (e.g. fields of the client cannot be read).

A workaround is to use the dynamic IP instead of the static one. An horrible solution, as the dynamic IP is short-lived and can change at any moment.

If I'm not mistaken, this should be easy to replicate: just have an interface with multiple addresses and try to connect from a client to different addresses and it should break. I am using 2.0.0-M4. I haven't tried with IPv4.

**Comment by boaks** [comment]
May be related to [IPv6](https://github.com/eclipse/californium/issues/315).

**Comment by alexbarcelo** [comment]
Yes, definetely that.

Reading that issue, I realized that maybe an easy and more robust workaround is to start the server as follows:

```
java -jar leshan-server-demo/target/leshan-server-demo-*-jar-with-dependencies.jar -lh [server_static_IP]
```

Thanks for pointing me to the solution :)
